"Organisation ID","OrganisationName","OrganisationType"
"ORG1","NIHR Leicester-Loughborough Diet Lifestyle and Physical activity Biomedical Research Unit","Biomedical Research Unit"
"ORG2","Greater Manchester CLAHRC","CLAHRC"
"ORG3","Salford Royal Foundation Trust Diabetes Team","NHS Trust"
"ORG4","Royal Berkshire Foundation Trust","NHS Trust"
"ORG5","Corby Clinical Commissioning Group","Clinical Commissioning Group"
"ORG6","Nene Clinical Commissioning Group","Clinical Commissioning Group"
"ORG7","Stoke-on-Trent Clinical Commissioning Group","Clinical Commissioning Group"
